{
  "schema_version": "0.1",
  "run_id": "run-d8f9c37a5714-acceptance",
  "status": "complete",
  "started_at": "2026-09-11T13:57:50.601153+00:00",
  "elapsed_seconds": 1.786312,
  "input": {
    "path": "data\\acceptance\\frozen-20260910\\captures\\download-01.pcapng",
    "sha256": "d8f9c37a57146377948b4792d7b0d86b8c95c83d8f23ffb6fabf445eb518f11f",
    "length": 1844
  },
  "profile": {
    "path": "profiles\\acceptance.json",
    "sha256": "4dfa13c047493a2809909899dce46a2bb3bdfa2c50e995a956f0be74a5e75502",
    "profile_id": "acceptance",
    "schema_version": "0.1"
  },
  "environment": {
    "python": "3.14.5",
    "platform": "Windows-11-10.0.26200-SP0",
    "tshark": {
      "path": null,
      "available": false,
      "version": null
    }
  },
  "stages": [
    {
      "stage": "M01",
      "status": "reused_verified",
      "elapsed_seconds": 0.022816,
      "reason": null
    },
    {
      "stage": "M02",
      "status": "completed",
      "elapsed_seconds": 0.00584,
      "reason": null
    },
    {
      "stage": "M07",
      "status": "reused_verified",
      "elapsed_seconds": 0.000154,
      "reason": null
    },
    {
      "stage": "PAYLOAD_SOURCES",
      "status": "completed",
      "elapsed_seconds": 0.03564,
      "reason": null
    },
    {
      "stage": "M08",
      "status": "completed",
      "elapsed_seconds": 0.070769,
      "reason": null
    },
    {
      "stage": "M03",
      "status": "completed",
      "elapsed_seconds": 0.001878,
      "reason": null
    },
    {
      "stage": "M04",
      "status": "completed",
      "elapsed_seconds": 0.002072,
      "reason": null
    },
    {
      "stage": "M05",
      "status": "completed",
      "elapsed_seconds": 0.001567,
      "reason": null
    },
    {
      "stage": "M06",
      "status": "completed",
      "elapsed_seconds": 0.001037,
      "reason": null
    },
    {
      "stage": "M09",
      "status": "completed",
      "elapsed_seconds": 0.040272,
      "reason": null
    },
    {
      "stage": "M10",
      "status": "completed",
      "elapsed_seconds": 0.025982,
      "reason": null
    },
    {
      "stage": "M11",
      "status": "reused_verified",
      "elapsed_seconds": 0.000187,
      "reason": null
    },
    {
      "stage": "M11_PREDICTION",
      "status": "completed",
      "elapsed_seconds": 1.28615,
      "reason": null
    },
    {
      "stage": "M12",
      "status": "completed",
      "elapsed_seconds": 0.218096,
      "reason": null
    }
  ],
  "artifacts": [
    {
      "module": "M01",
      "instance_id": "input",
      "path": "data\\acceptance\\frozen-20260910\\integration\\m01\\result.json",
      "sha256": "e236f49ff1c96489ae2973f31b88270953303bb9ed90182d90d97bbb724b3ac7",
      "length": 13907,
      "schema_version": "0.1",
      "status": "ok",
      "scope": {
        "input_sha256": "d8f9c37a57146377948b4792d7b0d86b8c95c83d8f23ffb6fabf445eb518f11f"
      }
    },
    {
      "module": "M02",
      "instance_id": "input",
      "path": "reports\\acceptance\\2026-09-11-abc\\run\\m02\\features.json",
      "sha256": "6f7541d10152829fe8ebf63d4e284b19cf24874643d6253acc47279f1c848b99",
      "length": 80268,
      "schema_version": "0.1",
      "status": "ok",
      "scope": {}
    },
    {
      "module": "M07",
      "instance_id": "input",
      "path": "data\\acceptance\\frozen-20260910\\full-chain\\m07\\protocols.json",
      "sha256": "d38700eaa02e2e1b48ec75d900af5379de38c23b5f6ceb19a38c18a22b6d48cf",
      "length": 2219,
      "schema_version": "0.1",
      "status": "ok",
      "scope": {}
    },
    {
      "module": "PAYLOAD_SOURCES",
      "instance_id": "http",
      "path": "reports\\acceptance\\2026-09-11-abc\\run\\payloads\\payload_sources.json",
      "sha256": "7e0a447b40d96b3e460bda09805c4a07a734b42c6c5888d0c19ec4c5437f53c5",
      "length": 2202,
      "schema_version": "0.1",
      "status": "ok",
      "scope": {}
    },
    {
      "module": "M08",
      "instance_id": "recovery-0000",
      "path": "reports\\acceptance\\2026-09-11-abc\\run\\m08\\0000\\recovery.json",
      "sha256": "7d46bd608aec11b2d0c6c222b175073607c7cddfeb7a1eb756d6dc175e2783fb",
      "length": 3117,
      "schema_version": "0.1",
      "status": "ok",
      "scope": {
        "source_id": "payload-download-01-d8f9c37a5714-tcp-stream-0-node1_to_node0-0000",
        "stream_id": "download-01-d8f9c37a5714-tcp-stream-0",
        "direction": "node1_to_node0"
      }
    },
    {
      "module": "M03",
      "instance_id": "structure",
      "path": "reports\\acceptance\\2026-09-11-abc\\run\\m03\\framing.json",
      "sha256": "9a88329ec8e91d857ba4fc299f4982fee31c76e1cf64373ab7cb7dafcdad618d",
      "length": 1377,
      "schema_version": "0.1",
      "status": "complete",
      "scope": {
        "rule_origin": "protocol_declared",
        "source": "first_http_body"
      }
    },
    {
      "module": "M04",
      "instance_id": "structure",
      "path": "reports\\acceptance\\2026-09-11-abc\\run\\m04\\clusters.json",
      "sha256": "dc2525e5904581d9357739d595b4d0163b8adc85048dd18e61d4e619532b5266",
      "length": 1296,
      "schema_version": "0.1",
      "status": "ok",
      "scope": {}
    },
    {
      "module": "M05",
      "instance_id": "structure",
      "path": "reports\\acceptance\\2026-09-11-abc\\run\\m05\\alignments.json",
      "sha256": "d41459777f500843afeae6e509c3b7fcdc3666b5332f2b824d2046e5d8a587de",
      "length": 1371,
      "schema_version": "0.1",
      "status": "ok",
      "scope": {}
    },
    {
      "module": "M06",
      "instance_id": "structure",
      "path": "reports\\acceptance\\2026-09-11-abc\\run\\m06\\format.json",
      "sha256": "38d264c7e6d532ef3ec8f7460b6c25abe654b06a6faf4218856583e0e128d7c8",
      "length": 1404,
      "schema_version": "0.1",
      "status": "empty",
      "scope": {}
    },
    {
      "module": "M09",
      "instance_id": "flows",
      "path": "reports\\acceptance\\2026-09-11-abc\\run\\m09\\flow_features.json",
      "sha256": "566e1cfb2ae26b4f945ec02806b9c96b27cfe03df5723a1cacc646a1fecd1b1e",
      "length": 3285,
      "schema_version": "0.1",
      "status": "ok",
      "scope": {}
    },
    {
      "module": "M10",
      "instance_id": "flows",
      "path": "reports\\acceptance\\2026-09-11-abc\\run\\m10\\behaviors.json",
      "sha256": "eb531240a35efd29f416d7b5588cb0b2c478140380ccc768b0c7165c8ed8facc",
      "length": 1632,
      "schema_version": "0.1",
      "status": "ok",
      "scope": {}
    },
    {
      "module": "M11",
      "instance_id": "trained-classifier",
      "path": "data\\acceptance\\frozen-20260910\\classification\\m11-v0.2\\run\\classification.json",
      "sha256": "5f18af38d0af3700ee61d16d93d5f24733fa371d2163e92a488c984cb660f7ad",
      "length": 7660,
      "schema_version": "0.1",
      "status": "ok",
      "scope": {}
    },
    {
      "module": "M11_PREDICTION",
      "instance_id": "new-input",
      "path": "reports\\acceptance\\2026-09-11-abc\\run\\m11\\prediction.json",
      "sha256": "64811820e53776def7d6e1ad36a75ba14935350ec21fecf1685277b7629f4086",
      "length": 958,
      "schema_version": "0.1",
      "status": "unknown",
      "scope": {}
    },
    {
      "module": "M12",
      "instance_id": "report",
      "path": "reports\\acceptance\\2026-09-11-abc\\run\\m12\\report_manifest.json",
      "sha256": "e40e30753a7005eb34054e8c7cb95be84774e6c602673e6211011d9276b8bb42",
      "length": 5007,
      "schema_version": "0.1",
      "status": "complete",
      "scope": {}
    }
  ],
  "model": {
    "status": "not_requested"
  },
  "limitations": [
    "M01 and M07 are verified frozen TShark artifacts because this portable host has no TShark installation.",
    "The M03 fixed boundary is protocol-declared from the extracted HTTP body and is not presented as automatic unknown-format discovery.",
    "The controlled 18-capture classifier result is not a broad traffic-generalization claim."
  ]
}
