{
  "schema_version": "0.1",
  "run_id": "run-47497f62366e-unknown-private-identifier-sensitive",
  "status": "complete",
  "started_at": "2026-09-11T16:18:38.106589+00:00",
  "elapsed_seconds": 24.850772,
  "input": {
    "path": "demo\\teacher-ubx-corpus\\held_out.ubx.bin",
    "sha256": "47497f62366e95028ae85776d734f950a57184415e18009cd711a0eda2e351da",
    "length": 37878
  },
  "profile": {
    "path": "profiles\\unknown-private-identifier-sensitive.json",
    "sha256": "9abf512c7400fc75e5eac55f37b5c669e4079b870942e14883d436a1b9aab43c",
    "profile_id": "unknown-private-identifier-sensitive",
    "schema_version": "0.1"
  },
  "environment": {
    "python": "3.13.9",
    "platform": "Windows-11-10.0.26200-SP0",
    "tshark": {
      "path": null,
      "available": false,
      "version": null
    }
  },
  "stages": [
    {
      "stage": "M01",
      "status": "completed",
      "elapsed_seconds": 0.003798,
      "reason": null
    },
    {
      "stage": "M02",
      "status": "completed",
      "elapsed_seconds": 0.074089,
      "reason": null
    },
    {
      "stage": "M03",
      "status": "completed",
      "elapsed_seconds": 0.369,
      "reason": null
    },
    {
      "stage": "M04",
      "status": "completed",
      "elapsed_seconds": 20.40968,
      "reason": null
    },
    {
      "stage": "M05",
      "status": "completed",
      "elapsed_seconds": 0.908084,
      "reason": null
    },
    {
      "stage": "M06",
      "status": "completed",
      "elapsed_seconds": 0.170831,
      "reason": null
    },
    {
      "stage": "M12",
      "status": "completed",
      "elapsed_seconds": 2.80097,
      "reason": null
    }
  ],
  "artifacts": [
    {
      "module": "M01",
      "instance_id": "input",
      "path": "demo\\teacher-ubx-result\\m01\\result.json",
      "sha256": "0af53184140ef0c56b059a2665f79cae80ccb62b2775f0836f03a8c60d29e59e",
      "length": 924,
      "schema_version": "0.1",
      "status": "ok",
      "scope": {
        "input_sha256": "47497f62366e95028ae85776d734f950a57184415e18009cd711a0eda2e351da"
      }
    },
    {
      "module": "M02",
      "instance_id": "input",
      "path": "demo\\teacher-ubx-result\\m02\\features.json",
      "sha256": "7ea068272b79e84d0ad1627aabb65f6858c0743d2eaccb36cb137022fdfb4f7d",
      "length": 1148887,
      "schema_version": "0.1",
      "status": "ok",
      "scope": {}
    },
    {
      "module": "M03",
      "instance_id": "structure",
      "path": "demo\\teacher-ubx-result\\m03\\framing.json",
      "sha256": "56727f19c993bf4f41fa6ce938515bc30b3992d1735845f4f6bf96ae9be279b1",
      "length": 453418,
      "schema_version": "0.1",
      "status": "complete",
      "scope": {
        "rule_origin": "automatically_inferred",
        "source": "input"
      }
    },
    {
      "module": "M04",
      "instance_id": "structure",
      "path": "demo\\teacher-ubx-result\\m04\\clusters.json",
      "sha256": "9c85b23a528a8d30698d6275f0308a8d652fc205c95d7ec319ca78aa9254e615",
      "length": 159396,
      "schema_version": "0.1",
      "status": "ok",
      "scope": {}
    },
    {
      "module": "M05",
      "instance_id": "structure",
      "path": "demo\\teacher-ubx-result\\m05\\alignments.json",
      "sha256": "b7a9326e6ac54889a929ff172d18278af17f4c81aaedcd74ba0ea9a2548d790f",
      "length": 3261291,
      "schema_version": "0.1",
      "status": "ok",
      "scope": {}
    },
    {
      "module": "M06",
      "instance_id": "structure",
      "path": "demo\\teacher-ubx-result\\m06\\format.json",
      "sha256": "96fff73dc70e55f2f3328a7d724c66fb7d3d64fe04b8460465c12cde45880a3c",
      "length": 611450,
      "schema_version": "0.1",
      "status": "ok",
      "scope": {}
    },
    {
      "module": "M12",
      "instance_id": "report",
      "path": "demo\\teacher-ubx-result\\m12\\report_manifest.json",
      "sha256": "a2786121b5a2b764e9cc33c7e6624b9e3f83b2849cb7f9b7eca23fe021f99ace",
      "length": 42076,
      "schema_version": "0.1",
      "status": "partial",
      "scope": {}
    }
  ],
  "model": {
    "status": "not_requested"
  },
  "limitations": [
    "This profile assumes repeated early bytes may act as a type discriminator; that is a statistical hypothesis, not a protocol definition.",
    "Only repeated length-prefixed hypotheses that cover the complete input are accepted automatically.",
    "Message clusters are statistical groups, not confirmed protocol message types.",
    "Field candidates and length relations are hypotheses; encrypted, compressed, delimited, or fixed-length formats can correctly remain unframed."
  ]
}
